<?xml version="1.0" encoding="UTF-8"?>
<oostethys xmlns="http://www.oostethys.org/schemas/0.1.0/oostethys"
    xmlns:xsi="http://www.w3.org/2001/XMLSchema-instance"
    xsi:schemaLocation="http://www.oostethys.org/schemas/0.1.0/oostethys ../oostethys.xsd">

    <webServerURL>http://localhost:8080</webServerURL>
    <serviceContact type="http://mmisw.org/mmi/20080520/obs.owl#serviceProvider" id="a1">
        <urlOrganization>http://www.marinemetadata.org</urlOrganization>
        <longNameOrganization>Marine Metadata Interoperability Initiative (MMI)</longNameOrganization>
        <shortNameOrganization>MMI</shortNameOrganization>
        <individualName/>
        <individualEmail/>
    </serviceContact>
    <components>
        <system>
            <metadata>
                <systemLongName>Monterey Bay Aquarium Research Institute Observing System</systemLongName>
                <systemShortName>MBARI</systemShortName>
                <systemIdentifier>urn:mbari:org</systemIdentifier>
                <systemType>http://mmisw.org/mmi/20080520/obs.owl#observationSystem</systemType>
                <systemContacts>
                    <systemContact type="http://mmisw.org/mmi/20080520/obs.owl#dataProvider" id="c1">
                        <urlOrganization>http://www.mbari.org</urlOrganization>
                        <longNameOrganization>Monterey Bay Aquarium Research Institute</longNameOrganization>
                        <shortNameOrganization>MBARI</shortNameOrganization>
                        <individualName>John Graybeal</individualName>
                        <individualEmail>graybeal@mbari.org</individualEmail>
                    </systemContact>
                </systemContacts>
            </metadata>
            <components>
                <system>
                    <metadata>
                        <systemLongName>Mooring M2</systemLongName>
                        <systemShortName>m2</systemShortName>
                        <systemIdentifier>uri:mbari:org:mooring:m2</systemIdentifier>
                        <systemType>http://mmisw.org/mmi/20080516/platform#MooredBuoy</systemType>
                        <systemContacts/>
                    </metadata>
                    <components>
                        <system>
                            <metadata>
                                <systemLongName>Serial CTD</systemLongName>
                                <systemShortName>1455</systemShortName>
                                <systemIdentifier>urn:mbari:org:device:1455</systemIdentifier>
                                <systemType>http://mmisw.org/mmi/20080529/sensor.owl#CTD</systemType>
                                <systemContacts/>
                            </metadata>
                            <output>
                                <sourceConfiguration>
                                    <oostethys-netcdf
                                        xmlns="http://www.oostethys.org/schemas/0.1.0/oostethys-netcdf">
                                        <fileURL>http://dods.mbari.org/cgi-bin/nph-nc/data/ssdsdata/deployments/m2/200804/m2_ctd0010_20080411_original.nc</fileURL>
                                        <variables>
                                            <variable standardName="time GMT"/>
                                            <variable standardName="longitude"/>
                                            <variable standardName="latitude"/>
                                            <variable standardName="depth"/>
                                            <variable standardName="Temperature"/>
                                            <variable standardName="Conductivity"/>
                                            <variable standardName="Pressure"/>
                                        </variables>
                                    </oostethys-netcdf>
                                </sourceConfiguration>
                            </output>
                        </system>
                        <system>
                            <metadata>
                                <systemLongName>Aanderaa Oxygen Optode (aanderaaoxy) </systemLongName>
                                <systemShortName>1595</systemShortName>
                                <systemIdentifier>urn:mbari:org:device:1595</systemIdentifier>
                                <systemType>http://mmisw.org/mmi/20080529/sensor.owl#OxygenSensor</systemType>
                                <systemContacts></systemContacts>
                            </metadata>
                       
                        <output>
                            <sourceConfiguration>
                                <oostethys-netcdf
                                    xmlns="http://www.oostethys.org/schemas/0.1.0/oostethys-netcdf">
                                    <fileURL>http://dods.mbari.org/cgi-bin/nph-nc/data/ssdsdata/deployments/m2/200804/m2_aanderaaoxy_20080411.nc</fileURL>
                                    <variables>
                                        <variable standardName="time GMT"/>
                                        <variable standardName="longitude"/>
                                        <variable standardName="latitude"/>
                                        <variable standardName="depth"/>
                                        <variable standardName="checkString"/>
                                        <variable standardName="Oxygen"/>
                                        <variable standardName="OxygenAirSaturation"/>
                                        <variable standardName="temperature"/>
                                    </variables>
                                </oostethys-netcdf>
                            </sourceConfiguration>
                        </output>
                        </system>
                    </components>
                </system>
            </components>
        </system>
    </components>
</oostethys>
