<?xml version="1.0" encoding="UTF-8"?>
<oostethys xmlns="http://www.oostethys.org/schemas/0.1.0/oostethys"
	xmlns:xsi="http://www.w3.org/2001/XMLSchema-instance"
	xsi:schemaLocation="http://www.oostethys.org/schemas/0.1.0/oostethys ../../main/resources/xml/oostethys/0.1.0/xsd/oostethys.xsd">
	
	<webServerURL>http://localhost:8080</webServerURL>
	<serviceContact
		type="http://mmisw.org/mmi/20080520/obs.owl#serviceProvider"
		id="a1">
		<urlOrganization>http://www.pfel.noaa.gov</urlOrganization>
		<longNameOrganization>
			NOAA/NMFS/SWFSC Environmental Research Division
		</longNameOrganization>
		<shortNameOrganization>ERD</shortNameOrganization>
		<individualName />
		<individualEmail />
	</serviceContact>
	
	<components>
		<system>
			<metadata>
				<systemLongName>Coastwatch Monthly SST Blended, Global, Experimental</systemLongName>
				<systemShortName>aggregsatBA_sstamday</systemShortName>
				<systemIdentifier>urn:usgs:gov:model:um1-gom</systemIdentifier>
				<systemType>
					http://mmisw.org/mmi/platform#Satellite
				</systemType>
				<systemContacts>
					<systemContact
						type="http://mmisw.org/mmi/20080520/obs.owl#dataProvider"
						id="c1">
						<urlOrganization>
							org
						</urlOrganization>
						<longNameOrganization>
							a long name
						</longNameOrganization>
						<shortNameOrganization>
							shortName
						</shortNameOrganization>
						<individualName>FirstName lastName</individualName>
						<individualEmail>xxx@xxx.org</individualEmail>
					</systemContact>
				</systemContacts>
			</metadata>
			
			
			<output>
				
				<sourceConfiguration>
					<oostethys-netcdf
						xmlns="http://www.oostethys.org/schemas/0.1.0/oostethys-netcdf">
						<fileURL>
							http://localhost:21983/oceanwatch.pfeg.noaa.gov/thredds/dodsC/satellite/BA/ssta/mday
						</fileURL>
						
						
							
						<variables>
							<variable shortName="altitude" dimension="depth" uri="http://mmisw.org/ont/cf/parameter/depth"/>
							<variable shortName="lat"  dimension="latitude" uri="urn:ogc:phenomenon:latitude:wgs84" />
							<variable shortName="lon" dimension="longitude" uri="urn:ogc:phenomenon:longitude:wgs84"/>
							<variable shortName="time"  dimension="time" uri="http://mmisw.org/ont/cf/parameter/iso_19118_time" />
							<variable shortName="BAssta" dimension="no" uri="http://mmisw.org/ont/cf/parameter/sea_water_temperature"/>
							
						</variables>
					</oostethys-netcdf>
					
					
				</sourceConfiguration>
				
			</output>
		</system>
		<system>
			<metadata>
				<systemLongName> Coastwatch 8day Primary Productivity Experimental</systemLongName>
				<systemShortName>aggregsatPN_bfp28day</systemShortName>
				<systemIdentifier>urn:usgs:gov:model:fvcom-gom</systemIdentifier>
				<systemType>http://mmisw.org/mmi/platform#Satellite </systemType>
				<systemContacts>
					<referencedContact ref="a1"/>
					
				</systemContacts>
			</metadata>
			
			
			
			<output>
				
				<sourceConfiguration>
					
					<oostethys-netcdf
						xmlns="http://www.oostethys.org/schemas/0.1.0/oostethys-netcdf">
						<fileURL> http://localhost:21983/oceanwatch.pfeg.noaa.gov/thredds/dodsC/satellite/PN/bfp2/8day </fileURL>
						
						<variables>
							<variable shortName="altitude" dimension="depth" uri="http://mmisw.org/ont/cf/parameter/depth"/>
							<variable shortName="lat"  dimension="latitude" uri="urn:ogc:phenomenon:latitude:wgs84" />
							<variable shortName="lon" dimension="longitude" uri="urn:ogc:phenomenon:longitude:wgs84"/>
							<variable shortName="time"  dimension="time" uri="http://mmisw.org/ont/cf/parameter/iso_19118_time" />
						
							<variable shortName="PNbfp2" dimension="no" uri="urn:no:no"  />
							
						</variables>
					</oostethys-netcdf>
					
				</sourceConfiguration>
				
			</output>
		</system>
		
	</components>
	
</oostethys>

 	  	 
