<?xml version="1.0" encoding="UTF-8"?>
<oos:oostethys
    xmlns:oos="http://www.oostethys.org/schemas/0.1.0/oostethys"
    xmlns:xsi="http://www.w3.org/2001/XMLSchema-instance"
    xsi:schemaLocation="http://www.oostethys.org/schemas/0.1.0/oostethys file:/Users/bermudez/Documents/workspace31/oostethys-xml/oostethys/0.1.0/oostethys.xsd">
    <oos:serviceContact
        type="http://mmisw.org/mmi/20080520/obs.owl#serviceProvider" id="a1"
        xmlns:xsi="http://www.w3.org/2001/XMLSchema-instance">
        <oos:urlOrganization>
            http://www.marinemetadata.org
        </oos:urlOrganization>
        <oos:longNameOrganization>
            Marine Metadata Interoperability Initiative (MMI)
        </oos:longNameOrganization>
        <oos:shortNameOrganization>MMI</oos:shortNameOrganization>
        <oos:individualName />
        <oos:individualEmail />
    </oos:serviceContact>
    <oos:components>
        <oos:system>
            <oos:metadata
                xmlns:xsi="http://www.w3.org/2001/XMLSchema-instance">
                <oos:systemLongName>USGS Model</oos:systemLongName>
                <oos:systemShortName>um</oos:systemShortName>
                <oos:systemIdentifier>
                    urn:usgs:org:model1
                </oos:systemIdentifier>
                <oos:systemType>
                    http://mmisw.org/mmi/20080520/obs.owl#numericalModel
                </oos:systemType>
                
                <oos:systemContacts>
                    <oos:systemContact
                        type="http://mmisw.org/mmi/20080520/obs.owl#dataProvider"
                        id="c1">
                        <oos:urlOrganization>
                            http://www.usgs.org
                        </oos:urlOrganization>
                        <oos:longNameOrganization>
                            USGS
                        </oos:longNameOrganization>
                        <oos:shortNameOrganization>
                            USGS
                        </oos:shortNameOrganization>
                        <oos:individualName>
                            Rick Ludich
                        </oos:individualName>
                        <oos:individualEmail>
                            r@usgs.org
                        </oos:individualEmail>
                    </oos:systemContact>
                </oos:systemContacts>
                <oos:lastKnownLocation srsName="urn:ogc:def:crs:EPSG:6.5:4326">
                    42.20551 -70.72384
                </oos:lastKnownLocation>
            </oos:metadata>
            <oos:extend>
                <oos:timePeriod>
                    <oos:start>2008-06-05T04:30:00Z</oos:start>
                    <oos:end>2008-06-05T23:30:00Z</oos:end>
                </oos:timePeriod>
                <oos:boundingBox>
                    <oos:envelope srsName="urn:ogc:def:crs:EPSG:6.5:4326">
                        <oos:lowerCorner>
                            42.20551 -70.72384
                        </oos:lowerCorner>
                        <oos:upperCorner>
                            42.20551 -70.72384
                        </oos:upperCorner>
                    </oos:envelope>
                </oos:boundingBox>
                
            </oos:extend>
            
            <oos:output>
                <oos:variables>
                    <oos:variable uri="urn:ogc:phenomenon:time:iso8601"
                        name="Time" uom="hours since 2006-01-01 00:00 UTC"
                        isCoordinate="true" isTime="true" />
                    <oos:variable
                        uri="urn:ogc:phenomenon:latitude:wgs84" name="latitude"
                        uom="degrees_north" isCoordinate="true" />
                    <oos:variable
                        uri="urn:ogc:phenomenon:longitude:wgs84" name="longitude"
                        uom="degrees_east" isCoordinate="true" />
                    <oos:variable
                        uri="http://marinemetadata.org/cf#sea_surface_height"
                        name="sea_surface_height" uom="" isCoordinate="false" />
                </oos:variables>
                <oos:values>
                    2008-06-05T04:30:00Z,42.20551,-70.72384,-1.01651
                    2008-06-05T05:30:00Z,42.20551,-70.72384,-1.761284
                    2008-06-05T06:30:00Z,42.20551,-70.72384,-2.052919
                    2008-06-05T07:30:00Z,42.20551,-70.72384,-1.811579
                    2008-06-05T08:30:00Z,42.20551,-70.72384,-1.114414
                    2008-06-05T09:30:00Z,42.20551,-70.72384,-0.151616
                    2008-06-05T10:30:00Z,42.20551,-70.72384,0.851955
                    2008-06-05T11:30:00Z,42.20551,-70.72384,1.641896
                    2008-06-05T12:30:00Z,42.20551,-70.72384,1.994201
                    2008-06-05T13:30:00Z,42.20551,-70.72384,1.843928
                    2008-06-05T14:30:00Z,42.20551,-70.72384,1.253456
                    2008-06-05T15:30:00Z,42.20551,-70.72384,0.370983
                    2008-06-05T16:30:00Z,42.20551,-70.72384,-0.621113
                    2008-06-05T17:30:00Z,42.20551,-70.72384,-1.475753
                    2008-06-05T18:30:00Z,42.20551,-70.72384,-1.951109
                    2008-06-05T19:30:00Z,42.20551,-70.72384,-1.923398
                    2008-06-05T20:30:00Z,42.20551,-70.72384,-1.406537
                    2008-06-05T21:30:00Z,42.20551,-70.72384,-0.548234
                    2008-06-05T22:30:00Z,42.20551,-70.72384,0.435682
                    2008-06-05T23:30:00Z,42.20551,-70.72384,1.319742
                </oos:values>
            </oos:output>
        </oos:system>
    </oos:components>
</oos:oostethys>