<?xml version="1.0" encoding="UTF-8"?>
<oostethys xmlns="http://www.oostethys.org/schemas/0.1.0/oostethys"
	xmlns:xsi="http://www.w3.org/2001/XMLSchema-instance"
	xsi:schemaLocation="http://www.oostethys.org/schemas/0.1.0/oostethys ../../main/resources/xml/oostethys/0.1.0/xsd/oostethys.xsd">


	<webServerURL>http://localhost:8080</webServerURL>
	<serviceContact type="http://mmisw.org/mmi/20080520/obs.owl#serviceProvider"
		id="a1">
		<urlOrganization>http://usgs.gov</urlOrganization>
		<longNameOrganization>
			USGS
		</longNameOrganization>
		<shortNameOrganization>usgs</shortNameOrganization>
		<individualName />
		<individualEmail />
	</serviceContact>

	<components>

		<system>
			<metadata>
				<sytemLongName> Model FVCOM - USGS - GOM</sytemLongName>
				<systemShortName>um2</systemShortName>
				<systemIdentifier>urn:usgs:gov:model:fvcom-gom</systemIdentifier>
				<systemType>http://mmisw.org/mmi/20080520/obs.owl#numericalModel</systemType>
				<systemContacts>
					<referencedContact ref="a1" />

				</systemContacts>
			</metadata>



			<output>

				<sourceConfiguration>

					<oostethys-netcdf
						xmlns="http://www.oostethys.org/schemas/0.1.0/oostethys-netcdf">
						<fileURL>umassb_scituate.nc</fileURL>

						<variables>
							<variable shortName="time" dimension="time"
								uri="urn:ogc:phenomenon:time:iso8601" />
							<variable shortName="lon" dimension="longitude"
								uri="urn:ogc:phenomenon:longitude:wgs84" />
							<variable shortName="lat" dimension="latitude"
								uri="urn:ogc:phenomenon:latitude:wgs84" />
							<variable shortName="elev" dimension="depth"
								uri="http://mmisw.org/ont/cf/parameter/depth" />




						</variables>
					</oostethys-netcdf>

				</sourceConfiguration>

			</output>
		</system>

	</components>

</oostethys>

 	  	 
