<?xml version="1.0" encoding="UTF-8"?>
<oostethys xmlns="http://www.oostethys.org/schemas/0.1.0/oostethys"
    xmlns:xsi="http://www.w3.org/2001/XMLSchema-instance"
    xsi:schemaLocation="http://www.oostethys.org/schemas/0.1.0/oostethys ../oostethys.xsd">

    <webServerURL>http://localhost:8080</webServerURL>
    <serviceContact type="http://mmisw.org/mmi/20080520/obs.owl#serviceProvider" id="a1">
        <urlOrganization>http://www.marinemetadata.org</urlOrganization>
        <longNameOrganization>Marine Metadata Interoperability Initiative (MMI)</longNameOrganization>
        <shortNameOrganization>MMI</shortNameOrganization>
        <individualName/>
        <individualEmail/>
    </serviceContact>

    <components>
        <system>
            <metadata>
                <sytemLongName>USGS Model</sytemLongName>
                <systemShortName>um</systemShortName>
                <systemIdentifier>urn:usgs:org:model1</systemIdentifier>
                <systemType>http://mmisw.org/mmi/20080520/obs.owl#numericalModel</systemType>
                <systemContacts>
                    <systemContact type="http://mmisw.org/mmi/20080520/obs.owl#dataProvider" id="c1">
                        <urlOrganization>http://www.usgs.org</urlOrganization>
                        <longNameOrganization>USGS</longNameOrganization>
                        <shortNameOrganization>USGS</shortNameOrganization>
                        <individualName>Rick Ludich</individualName>
                        <individualEmail>r@usgs.org</individualEmail>
                    </systemContact>
                </systemContacts>
            </metadata>

            <extend>
                <timePeriod>
                    <start>2008-06-05T04:30:00Z</start>
                    <end>2008-06-05T23:30:00Z</end>
                </timePeriod>
                <boundingBox>
                    <envelope srsName="urn:ogc:def:crs:EPSG:6.5:4326">
                        <lowerCorner>42.20551 -70.72384</lowerCorner>
                        <upperCorner>42.20551 -70.72384</upperCorner>
                    </envelope>
                </boundingBox>
            </extend>
<!--
            <output>

                <sourceConfiguration>
                    <oostethys-netcdf
                        xmlns="http://www.oostethys.org/schemas/0.1.0/oostethys-netcdf">
                        <fileURL>file:/Users/bermudez/Documents/workspace31/org.oostethys/etc/umassb_scituate.nc</fileURL>

                        <variables>
                            <variable standardName="Time"/>
                            <variable standardName="longitude"/>
                            <variable standardName="latitude"/>
                            <variable standardName="sea_surface_height"/>

                        </variables>
                    </oostethys-netcdf>

                </sourceConfiguration>
                <variables>
                    <variable name="Time" uri="urn:ogc:phenomenon:time:iso8601"
                        uom="hours since 2006-01-01 00:00 UTC" isTime="true"
                        isCoordinate="true"/>
                    <variable name="longitude" uri="urn:ogc:phenomenon:longitude:wgs84"
                        uom="degrees_east"/>
                    <variable name="latitude" uri="urn:ogc:phenomenon:latitude:wgs84"
                        uom="degrees_north"/>
                    <variable name="sea_surface_height"
                        uri="http://marinemetadata.org/cf#sea_surface_height" uom="meters"/>
                </variables>
                <values> 2008-06-05T04:30:00Z,42.20551,-70.72384,-1.01651
                    2008-06-05T05:30:00Z,42.20551,-70.72384,-1.761284
                    2008-06-05T06:30:00Z,42.20551,-70.72384,-2.052919
                    2008-06-05T07:30:00Z,42.20551,-70.72384,-1.811579
                    2008-06-05T08:30:00Z,42.20551,-70.72384,-1.114414
                    2008-06-05T09:30:00Z,42.20551,-70.72384,-0.151616
                    2008-06-05T10:30:00Z,42.20551,-70.72384,0.851955
                    2008-06-05T11:30:00Z,42.20551,-70.72384,1.641896
                    2008-06-05T12:30:00Z,42.20551,-70.72384,1.994201
                    2008-06-05T13:30:00Z,42.20551,-70.72384,1.843928
                    2008-06-05T14:30:00Z,42.20551,-70.72384,1.253456
                    2008-06-05T15:30:00Z,42.20551,-70.72384,0.370983
                    2008-06-05T16:30:00Z,42.20551,-70.72384,-0.621113
                    2008-06-05T17:30:00Z,42.20551,-70.72384,-1.475753
                    2008-06-05T18:30:00Z,42.20551,-70.72384,-1.951109
                    2008-06-05T19:30:00Z,42.20551,-70.72384,-1.923398
                    2008-06-05T20:30:00Z,42.20551,-70.72384,-1.406537
                    2008-06-05T21:30:00Z,42.20551,-70.72384,-0.548234
                    2008-06-05T22:30:00Z,42.20551,-70.72384,0.435682
                    2008-06-05T23:30:00Z,42.20551,-70.72384,1.319742</values>
            </output>
-->
          
            <components>
                <system>
                    <metadata>
                        <sytemLongName>test level 2</sytemLongName>
                        <systemShortName>sb1</systemShortName>
                        <systemIdentifier>uri:2</systemIdentifier>
                        <systemType>uri:type:x</systemType>
                        <systemContacts></systemContacts>
                    </metadata>
                    <output>
                    <sourceConfiguration>
                        <oostethys-netcdf
                            xmlns="http://www.oostethys.org/schemas/0.1.0/oostethys-netcdf">
                            <fileURL>file:/Users/bermudez/Documents/workspace31/org.oostethys/etc/umassb_scituate.nc</fileURL>
                            
                            <variables>
                                <variable standardName="Time"/>
                                <variable standardName="longitude"/>
                                <variable standardName="latitude"/>
                                <variable standardName="sea_surface_height"/>
                                
                            </variables>
                        </oostethys-netcdf>
                        
                    </sourceConfiguration>
                    
                    
                    
                    <variables>
                        <variable name="Time" uri="urn:ogc:phenomenon:time:iso8601" uom="hours since
                            2006-01-01 00:00 UTC" isTime="true" isCoordinate="true"/>
                        <variable name="longitude" uri="urn:ogc:phenomenon:longitude:wgs84" uom="degrees_east"/>
                        <variable name="latitude" uri="urn:ogc:phenomenon:latitude:wgs84" uom="degrees_north"/>
                        <variable name="sea_surface_height" uri="http://marinemetadata.org/cf#sea_surface_height" uom="meters"/>
                    </variables>
                    <values> 2008-06-05T04:30:00Z,42.20551,-70.72384,-1.01651 2008-06-05T05:30:00Z,42.20551,-70.72384,-1.761284 2008-06-05T06:30:00Z,42.20551,-70.72384,-2.052919 2008-06-05T07:30:00Z,42.20551,-70.72384,-1.811579 2008-06-05T08:30:00Z,42.20551,-70.72384,-1.114414 2008-06-05T09:30:00Z,42.20551,-70.72384,-0.151616 2008-06-05T10:30:00Z,42.20551,-70.72384,0.851955 2008-06-05T11:30:00Z,42.20551,-70.72384,1.641896 2008-06-05T12:30:00Z,42.20551,-70.72384,1.994201 2008-06-05T13:30:00Z,42.20551,-70.72384,1.843928 2008-06-05T14:30:00Z,42.20551,-70.72384,1.253456 2008-06-05T15:30:00Z,42.20551,-70.72384,0.370983 2008-06-05T16:30:00Z,42.20551,-70.72384,-0.621113 2008-06-05T17:30:00Z,42.20551,-70.72384,-1.475753 2008-06-05T18:30:00Z,42.20551,-70.72384,-1.951109 2008-06-05T19:30:00Z,42.20551,-70.72384,-1.923398 2008-06-05T20:30:00Z,42.20551,-70.72384,-1.406537 2008-06-05T21:30:00Z,42.20551,-70.72384,-0.548234 2008-06-05T22:30:00Z,42.20551,-70.72384,0.435682 2008-06-05T23:30:00Z,42.20551,-70.72384,1.319742</values>
                    </output>
                </system>
            </components>
            
          
        </system>

    </components>

</oostethys>
