<?xml version="1.0" encoding="UTF-8"?>
<oostethys xmlns="http://www.oostethys.org/schemas/0.1.0/oostethys" xmlns:xsi="http://www.w3.org/2001/XMLSchema-instance"
    xsi:schemaLocation="http://www.oostethys.org/schemas/0.1.0/oostethys ../xml/oostethys/0.1.0/oostethys.xsd">

    <!-- 
    
    		This is an example OOSTethys configuration file, which takes a netcdf and makes available an SOS based on OOSTethys conventions. 
    		
    		OOSTehtys has components. Components are systems.  Systems could be observing systems, platforms, sensors , etc.
    		
    	    A System could contain components or output. 
    	    
    	    Output has sourceConfiguration - which in this case is a oostethys-netcdf configuration.
    	    
    	    oostethys-netcdf needs a URL of the file and the short name of the variables. The short name of the variable is the
    	    title of the variable that appears after the type when you see the header of a netcdf file or call the dump function.
    	    In the following example, the short name =  "Temp". This are unique within a file. 
    	    
    	    ...
    	     variables:
		   float Temp(esecs=8265, NominalDepth=1, Latitude=1, Longitude=1);
    		 :long_name = "Water Temperature";
		     :units = "deg C";
		     :standard_name = "Temperature";
		     
		     ...
		     
		     
    	If you have any problems please send an email to oostethys-support@lists.sourceforge.net
     -->


    <!--  This value is not neccesary. It will be filled by the web application. Leave it in blank -->
    <webServerURL/>

    <!--  SOS service metadata -->
    <serviceContact type="http://mmisw.org/mmi/20080520/obs.owl#serviceProvider" id="a1">
        <urlOrganization>http://nccoos.org</urlOrganization>
        <longNameOrganization>University of North Carolina at Chapel Hill</longNameOrganization>
        <shortNameOrganization>UNC-CH</shortNameOrganization>
        <individualName>Jesse Cleary</individualName>
        <individualEmail>jcleary@email.unc.edu</individualEmail>
    </serviceContact>

    <!--  Components could be observing systems, platforms, sensors , etc... -->
    <components>
        <system>
            <metadata>
                <sytemLongName>TWS Met station observation</sytemLongName>
                <systemShortName>jpier</systemShortName>
                <systemIdentifier>urn:unc:org:jpier</systemIdentifier>
                <systemType>http://mmisw.org/ont/Platform/metereologicalPlatform</systemType>
                <systemContacts>
                    <systemContact type="http://mmisw.org/mmi/20080520/obs.owl#dataProvider" id="c1">

                        <urlOrganization>http://nccoos.org</urlOrganization>
                        <longNameOrganization>University of North Carolina at Chapel Hill</longNameOrganization>
                        <shortNameOrganization>UNC-CH</shortNameOrganization>
                        <individualName>Jesse Cleary</individualName>
                        <individualEmail>jcleary@email.unc.edu</individualEmail>
                    </systemContact>
                </systemContacts>
            </metadata>

            <output>
                <sourceConfiguration>
                    <!--  source configuration is the information necessary to parse the NetCdf file  -->

                    <oostethys-netcdf xmlns="http://www.oostethys.org/schemas/0.1.0/oostethys-netcdf">

                        <!--   URL of the NETCDF file or OPENDAP link. It could also be a relative path to
                                        the WEB_INF/classes folder in the web application -->

                        <fileURL>http://whewell.marine.unc.edu/data/nccoos/latest_v2.0/nccoos_jpier_met_latest.nc</fileURL>

                        <!--   ShortName of each variable. At least
				                             lat, lon and time coordinates should be given 
				                            -->

                        <variables>
                            <variable shortName="time"/>
                            <variable shortName="air_temp"/>
                            <variable shortName="wdir"/>
                            <variable shortName="air_pressure"/>
                            <variable shortName="humidity"/>
                            <variable shortName="wspd"/>
                            <variable shortName="lat"/>
                            <variable shortName="z"/>
                            <variable shortName="lon"/>
                            
                        </variables>
                    </oostethys-netcdf>
                </sourceConfiguration>
            </output>

        </system>


    </components>
</oostethys>
